Sheet: major-off-categories
A1: Rank | B1: Open Food Facts Category | C1: Products Count
A2: 1 | B2: Plant-based foods and beverages | C2: 136214
A3: of:=[.$A2]+1 -> 2 | B3: Plant-based foods | C3: 117363
A4: of:=[.$A3]+1 -> 3 | B4: Snacks | C4: 65304
A5: of:=[.$A4]+1 -> 4 | B5: Beverages | C5: 58403
A6: of:=[.$A5]+1 -> 5 | B6: Sweet snacks | C6: 53428
A7: of:=[.$A6]+1 -> 6 | B7: Dairies | C7: 49517
A8: of:=[.$A7]+1 -> 7 | B8: Cereals and potatoes | C8: 39612
A9: of:=[.$A8]+1 -> 8 | B9: Fruits and vegetables based foods | C9: 39364
A10: of:=[.$A9]+1 -> 9 | B10: Meats | C10: 36856
A11: of:=[.$A10]+1 -> 10 | B11: Fermented foods | C11: 35716
A12: of:=[.$A11]+1 -> 11 | B12: Fermented milk products | C12: 35285
A13: of:=[.$A12]+1 -> 12 | B13: Meals | C13: 32874
A14: of:=[.$A13]+1 -> 13 | B14: Groceries | C14: 28608
A15: of:=[.$A14]+1 -> 14 | B15: Spreads | C15: 27382
A16: of:=[.$A15]+1 -> 15 | B16: Biscuits and cakes | C16: 25531
A17: of:=[.$A16]+1 -> 16 | B17: Cereals and their products | C17: 25269
A18: of:=[.$A17]+1 -> 17 | B18: Cheeses | C18: 23276
A19: of:=[.$A18]+1 -> 18 | B19: Breakfasts | C19: 22756
A20: of:=[.$A19]+1 -> 19 | B20: Prepared meats | C20: 21634
A21: of:=[.$A20]+1 -> 20 | B21: Plant-based beverages | C21: 21320
A22: of:=[.$A21]+1 -> 21 | B22: Fruits based foods | C22: 20800
A23: of:=[.$A22]+1 -> 22 | B23: Sauces | C23: 19471
A24: of:=[.$A23]+1 -> 23 | B24: Desserts | C24: 18811
A25: of:=[.$A24]+1 -> 24 | B25: Vegetables based foods | C25: 16561
A26: of:=[.$A25]+1 -> 25 | B26: Seafood | C26: 15579
A27: of:=[.$A26]+1 -> 26 | B27: Sweet spreads | C27: 15420
A28: of:=[.$A27]+1 -> 27 | B28: Confectioneries | C28: 15169
A29: of:=[.$A28]+1 -> 28 | B29: Canned foods | C29: 14633
A30: of:=[.$A29]+1 -> 29 | B30: Frozen foods | C30: 14121
A31: of:=[.$A30]+1 -> 30 | B31: Plant-based spreads | C31: 12983
A32: of:=[.$A31]+1 -> 31 | B32: Fishes | C32: 12798
A33: of:=[.$A32]+1 -> 32 | B33: Biscuits | C33: 12235
A34: of:=[.$A33]+1 -> 33 | B34: Alcoholic beverages | C34: 11814
A35: of:=[.$A34]+1 -> 34 | B35: Fats | C35: 11634
A36: of:=[.$A35]+1 -> 35 | B36: Salty snacks | C36: 11306
A37: of:=[.$A36]+1 -> 36 | B37: Chocolates | C37: 11213
A38: of:=[.$A37]+1 -> 37 | B38: Fruit-based beverages | C38: 11129
A39: of:=[.$A38]+1 -> 38 | B39: Yogurts | C39: 10946
A40: of:=[.$A39]+1 -> 39 | B40: Condiments | C40: 10936
A41: of:=[.$A40]+1 -> 40 | B41: Breads | C41: 10386
A42: of:=[.$A41]+1 -> 41 | B42: Juices and nectars | C42: 9769
A43: of:=[.$A42]+1 -> 42 | B43: Poultries | C43: 9352
A44: of:=[.$A43]+1 -> 43 | B44: Legumes and their products | C44: 9292
A45: of:=[.$A44]+1 -> 44 | B45: Appetizers | C45: 9042
A46: of:=[.$A45]+1 -> 45 | B46: Nuts and their products | C46: 8922
A47: of:=[.$A46]+1 -> 46 | B47: Meat-based products | C47: 8639
A48: of:=[.$A47]+1 -> 47 | B48: Seeds | C48: 8522
A49: of:=[.$A48]+1 -> 48 | B49: Dried products | C49: 8371
A50: of:=[.$A49]+1 -> 49 | B50: Cakes | C50: 8177
A51: of:=[.$A50]+1 -> 50 | B51: Vegetable fats | C51: 7879
A52: of:=[.$A51]+1 -> 51 | B52: Canned plant-based foods | C52: 7819
A53: of:=[.$A52]+1 -> 52 | B53: Sweeteners | C53: 7566
A54: of:=[.$A53]+1 -> 53 | B54: Sweetened beverages | C54: 7469
A55: of:=[.$A54]+1 -> 54 | B55: Cow cheeses | C55: 7364
A56: of:=[.$A55]+1 -> 55 | B56: Jams | C56: 7320
A57: of:=[.$A56]+1 -> 56 | B57: Fruit juices | C57: 7246
A58: of:=[.$A57]+1 -> 57 | B58: French cheeses | C58: 7050
A59: of:=[.$A58]+1 -> 58 | B59: Olive tree products | C59: 6887
A60: of:=[.$A59]+1 -> 59 | B60: Salted spreads | C60: 6862
A61: of:=[.$A60]+1 -> 60 | B61: Fresh foods | C61: 6858
A62: of:=[.$A61]+1 -> 61 | B62: Vegetable oils | C62: 6785
A63: of:=[.$A62]+1 -> 62 | B63: Legumes | C63: 6751
A64: of:=[.$A63]+1 -> 63 | B64: Hot beverages | C64: 6746
A65: of:=[.$A64]+1 -> 64 | B65: Meals with meat | C65: 6636
A66: of:=[.$A65]+1 -> 65 | B66: Chickens | C66: 6609
A67: of:=[.$A66]+1 -> 66 | B67: Farming products | C67: 6384
A68: of:=[.$A67]+1 -> 67 | B68: Breakfast cereals | C68: 6122
A69: of:=[.$A68]+1 -> 68 | B69: Chips and fries | C69: 5891
A70: of:=[.$A69]+1 -> 69 | B70: Frozen desserts | C70: 5711
A71: of:=[.$A70]+1 -> 70 | B71: Wines | C71: 5521
A72: of:=[.$A71]+1 -> 71 | B72: Fruits | C72: 5488
A73: of:=[.$A72]+1 -> 72 | B73: Carbonated drinks | C73: 5474
A74: of:=[.$A73]+1 -> 73 | B74: Milks | C74: 5396
A75: of:=[.$A74]+1 -> 74 | B75: Nuts | C75: 5392
A76: of:=[.$A75]+1 -> 75 | B76: Dried plant-based foods | C76: 5390
A77: of:=[.$A76]+1 -> 76 | B77: Crisps | C77: 5319
A78: of:=[.$A77]+1 -> 77 | B78: Ice creams and sorbets | C78: 4947
A79: of:=[.$A78]+1 -> 78 | B79: Chocolate candies | C79: 4897
A80: of:=[.$A79]+1 -> 79 | B80: Canned vegetables | C80: 4865
A81: of:=[.$A80]+1 -> 80 | B81: Hams | C81: 4836
A82: of:=[.$A81]+1 -> 81 | B82: Bee products | C82: 4808
A83: of:=[.$A82]+1 -> 82 | B83: Dark chocolates | C83: 4704
A84: of:=[.$A83]+1 -> 83 | B84: Olive oils | C84: 4582
A85: of:=[.$A84]+1 -> 84 | B85: Soups | C85: 4519
A86: of:=[.$A85]+1 -> 85 | B86: Sausages | C86: 4453
A87: of:=[.$A86]+1 -> 86 | B87: Honeys | C87: 4410
A88: of:=[.$A87]+1 -> 87 | B88: Pastries | C88: 4390
A89: of:=[.$A88]+1 -> 88 | B89: Cereal grains | C89: 4374
A90: of:=[.$A89]+1 -> 89 | B90: Candies | C90: 4363
A91: of:=[.$A90]+1 -> 90 | B91: Dried fruits | C91: 4205
A92: of:=[.$A91]+1 -> 91 | B92: Viennoiseries | C92: 4104
A93: of:=[.$A92]+1 -> 92 | B93: Sodas | C93: 4043
A94: of:=[.$A93]+1 -> 93 | B94: Beers | C94: 3871
A95: of:=[.$A94]+1 -> 94 | B95: Cooked pressed cheeses | C95: 3835
A96: of:=[.$A95]+1 -> 95 | B96: Dairy desserts | C96: 3828
A97: of:=[.$A96]+1 -> 96 | B97: Pickles | C97: 3747
A98: of:=[.$A97]+1 -> 97 | B98: Unsweetened beverages | C98: 3581
A99: of:=[.$A98]+1 -> 98 | B99: Tomato sauces | C99: 3580
A100: of:=[.$A99]+1 -> 99 | B100: Pizzas pies and quiches | C100: 3520
A101: of:=[.$A100]+1 -> 100 | B101: Teas | C101: 3518
A102: of:=[.$A101]+1 -> 101 | B102: Plant-based pickles | C102: 3476
A103: of:=[.$A102]+1 -> 102 | B103: Extra-virgin olive oils | C103: 3463
A104: of:=[.$A103]+1 -> 103 | B104: Canned fishes | C104: 3463
A105: of:=[.$A104]+1 -> 104 | B105: Pasta dishes | C105: 3435
A106: of:=[.$A105]+1 -> 105 | B106: Coffees | C106: 3368
A107: of:=[.$A106]+1 -> 106 | B107: Bars | C107: 3355
A108: of:=[.$A107]+1 -> 107 | B108: Bonbons | C108: 3278
A109: of:=[.$A108]+1 -> 108 | B109: Legume seeds | C109: 3245
A110: of:=[.$A109]+1 -> 109 | B110: Waters | C110: 3236
A111: of:=[.$A110]+1 -> 110 | B111: Dietary supplements | C111: 3195
A112: of:=[.$A111]+1 -> 111 | B112: Herbal teas | C112: 3155
A113: of:=[.$A112]+1 -> 112 | B113: Spreadable fats | C113: 3140
A114: of:=[.$A113]+1 -> 113 | B114: Pulses | C114: 3139
A115: of:=[.$A114]+1 -> 114 | B115: Syrups | C115: 3137
A116: of:=[.$A115]+1 -> 115 | B116: Dried products to be rehydrated | C116: 3088
A117: of:=[.$A116]+1 -> 116 | B117: Chocolate biscuits | C117: 3081
A118: of:=[.$A117]+1 -> 117 | B118: Meals with fish | C118: 3066
A119: of:=[.$A118]+1 -> 118 | B119: Spices | C119: 3021
A120: of:=[.$A119]+1 -> 119 | B120: Fruit yogurts | C120: 2989
A121: of:=[.$A120]+1 -> 120 | B121: Milk chocolates | C121: 2940
A122: of:=[.$A121]+1 -> 121 | B122: Compotes | C122: 2928
A123: of:=[.$A122]+1 -> 122 | B123: Salads | C123: 2887
A124: of:=[.$A123]+1 -> 123 | B124: Berry jams | C124: 2880
A125: of:=[.$A124]+1 -> 124 | B125: Christmas foods and drinks | C125: 2817
A126: of:=[.$A125]+1 -> 125 | B126: Microwave meals | C126: 2720
A127: of:=[.$A126]+1 -> 126 | B127: Milk substitute | C127: 2696
A128: of:=[.$A127]+1 -> 127 | B128: Salmons | C128: 2696
A129: of:=[.$A128]+1 -> 128 | B129: Tomatoes and their products | C129: 2686
A130: of:=[.$A129]+1 -> 129 | B130: Mustards | C130: 2677
A131: of:=[.$A130]+1 -> 130 | B131: Plant milks | C131: 2659
A132: of:=[.$A131]+1 -> 131 | B132: Fish and meat and eggs | C132: 2656
A133: of:=[.$A132]+1 -> 132 | B133: Poultry meals | C133: 2642
A134: of:=[.$A133]+1 -> 133 | B134: Smoked fishes | C134: 2635
A135: of:=[.$A134]+1 -> 134 | B135: Tunas | C135: 2601
A136: of:=[.$A135]+1 -> 135 | B136: Fresh plant-based foods | C136: 2588
A137: of:=[.$A136]+1 -> 136 | B137: Artificially sweetened beverages | C137: 2562
A138: of:=[.$A137]+1 -> 137 | B138: Chicken breasts | C138: 2496
A139: of:=[.$A138]+1 -> 138 | B139: Flakes | C139: 2474
A140: of:=[.$A139]+1 -> 139 | B140: Squeezed juices | C140: 2458
A141: of:=[.$A140]+1 -> 140 | B141: Pizzas | C141: 2456
A142: of:=[.$A141]+1 -> 141 | B142: White hams | C142: 2453
A143: of:=[.$A142]+1 -> 142 | B143: Cereal flakes | C143: 2441
A144: of:=[.$A143]+1 -> 143 | B144: Non-Alcoholic beverages | C144: 2411
A145: of:=[.$A144]+1 -> 144 | B145: Wines from France | C145: 2406
A146: of:=[.$A145]+1 -> 145 | B146: Italian cheeses | C146: 2404
A147: of:=[.$A146]+1 -> 146 | B147: Rices | C147: 2366
A148: of:=[.$A147]+1 -> 147 | B148: Culinary plants | C148: 2288
A149: of:=[.$A148]+1 -> 148 | B149: Crackers | C149: 2286
A150: of:=[.$A149]+1 -> 149 | B150: Animal fats | C150: 2272
A151: of:=[.$A150]+1 -> 150 | B151: Potato crisps | C151: 2261
A152: of:=[.$A151]+1 -> 151 | B152: Sandwiches | C152: 2260
A153: of:=[.$A152]+1 -> 152 | B153: Dairy drinks | C153: 2259
A154: of:=[.$A153]+1 -> 153 | B154: Frozen ready-made meals | C154: 2248
A155: of:=[.$A154]+1 -> 154 | B155: Olives | C155: 2246
A156: of:=[.$A155]+1 -> 155 | B156: Frozen plant-based foods | C156: 2244
A157: of:=[.$A156]+1 -> 156 | B157: Canned legumes | C157: 2220
A158: of:=[.$A157]+1 -> 157 | B158: Prepared vegetables | C158: 2214
A159: of:=[.$A158]+1 -> 158 | B159: Prepared salads | C159: 2205
A160: of:=[.$A159]+1 -> 159 | B160: Pies | C160: 2196
A161: of:=[.$A160]+1 -> 160 | B161: Spring waters | C161: 2180
A162: of:=[.$A161]+1 -> 161 | B162: Dry pasta | C162: 2173
A163: of:=[.$A162]+1 -> 162 | B163: Baby foods | C163: 2155
A164: of:=[.$A163]+1 -> 163 | B164: Flours | C164: 2146
A165: of:=[.$A164]+1 -> 164 | B165: Milkfat | C165: 2118
A166: of:=[.$A165]+1 -> 165 | B166: Vinegars | C166: 2118
A167: of:=[.$A166]+1 -> 166 | B167: Dairy spread | C167: 2106
A168: of:=[.$A167]+1 -> 167 | B168: Butters | C168: 2104
A169: of:=[.$A168]+1 -> 168 | B169: Fish preparations | C169: 2103
A170: of:=[.$A169]+1 -> 169 | B170: Pasteurized cheeses | C170: 2087
A171: of:=[.$A170]+1 -> 170 | B171: Foies gras | C171: 2087
A172: of:=[.$A171]+1 -> 171 | B172: Vegetable soups | C172: 2081
A173: of:=[.$A172]+1 -> 172 | B173: Fish fillets | C173: 2079
A174: of:=[.$A173]+1 -> 173 | B174: Apple compotes | C174: 2073
A175: of:=[.$A174]+1 -> 174 | B175: Mayonnaises | C175: 2056
A176: of:=[.$A175]+1 -> 175 | B176: Mueslis | C176: 2017
A177: of:=[.$A176]+1 -> 176 | B177: Turkeys | C177: 2003
A178: of:=[.$A177]+1 -> 177 | B178: Rillettes | C178: 2000
A179: of:=[.$A178]+1 -> 178 | B179: Fresh vegetables | C179: 1997
A180: of:=[.$A179]+1 -> 179 | B180: Terrines | C180: 1975
A181: of:=[.$A180]+1 -> 180 | B181: Cream cheeses | C181: 1961
A182: of:=[.$A181]+1 -> 181 | B182: Smoked salmons | C182: 1937
A183: of:=[.$A182]+1 -> 182 | B183: Pork | C183: 1936
A184: of:=[.$A183]+1 -> 183 | B184: Eggs | C184: 1932
A185: of:=[.$A184]+1 -> 184 | B185: Refrigerated foods | C185: 1924
A186: of:=[.$A185]+1 -> 185 | B186: Mineral waters | C186: 1920
A187: of:=[.$A186]+1 -> 186 | B187: Beef | C187: 1920
A188: of:=[.$A187]+1 -> 187 | B188: Foies gras from ducks | C188: 1902
A189: of:=[.$A188]+1 -> 188 | B189: Christmas sweets | C189: 1897
A190: of:=[.$A189]+1 -> 189 | B190: Uncooked pressed cheeses | C190: 1845
A191: of:=[.$A190]+1 -> 190 | B191: Flavoured syrups | C191: 1816
A192: of:=[.$A191]+1 -> 191 | B192: Cookies | C192: 1815
A193: of:=[.$A192]+1 -> 192 | B193: Stuffed pastas | C193: 1791
A194: of:=[.$A193]+1 -> 193 | B194: Wheat pasta | C194: 1754
A195: of:=[.$A194]+1 -> 194 | B195: Instant beverages | C195: 1753
A196: of:=[.$A195]+1 -> 195 | B196: Canned meals | C196: 1750
A197: of:=[.$A196]+1 -> 196 | B197: Orange juices | C197: 1737
A198: of:=[.$A197]+1 -> 197 | B198: French sausages | C198: 1737
A199: of:=[.$A198]+1 -> 198 | B199: Special breads | C199: 1720
A200: of:=[.$A199]+1 -> 199 | B200: Apple juices | C200: 1712
A201: of:=[.$A200]+1 -> 200 | B201: Fruit nectars | C201: 1681
A202: of:=[.$A201]+1 -> 201 | B202: Frozen vegetables | C202: 1673
A203: of:=[.$A202]+1 -> 202 | B203: Greek yogurts | C203: 1667
A204: of:=[.$A203]+1 -> 203 | B204: Noodles | C204: 1667
A205: of:=[.$A204]+1 -> 204 | B205: Soft cheeses with bloomy rind | C205: 1634
A206: of:=[.$A205]+1 -> 205 | B206: Ketchup | C206: 1627
A207: of:=[.$A206]+1 -> 206 | B207: Meat analogues | C207: 1620
A208: of:=[.$A207]+1 -> 207 | B208: Breaded products | C208: 1618
A209: of:=[.$A208]+1 -> 208 | B209: Bodybuilding supplements | C209: 1616
A210: of:=[.$A209]+1 -> 209 | B210: Sardines | C210: 1611
A211: of:=[.$A210]+1 -> 210 | B211: Chocolate cakes | C211: 1578
A212: of:=[.$A211]+1 -> 211 | B212: Oilseed purees | C212: 1566
A213: of:=[.$A212]+1 -> 212 | B213: Creams | C213: 1555
A214: of:=[.$A213]+1 -> 213 | B214: Durum wheat pasta | C214: 1549
A215: of:=[.$A214]+1 -> 214 | B215: Tropical fruits | C215: 1545
A216: of:=[.$A215]+1 -> 215 | B216: Homogenized milks | C216: 1543
A217: of:=[.$A216]+1 -> 216 | B217: Vegetable rods | C217: 1541
A218: of:=[.$A217]+1 -> 217 | B218: Shortbread cookies | C218: 1525
A219: of:=[.$A218]+1 -> 218 | B219: Leaf vegetables | C219: 1525
A220: of:=[.$A219]+1 -> 219 | B220: Cereal flours | C220: 1521
A221: of:=[.$A220]+1 -> 220 | B221: Corn chips | C221: 1514
A222: of:=[.$A221]+1 -> 221 | B222: Madeleines | C222: 1508
A223: of:=[.$A222]+1 -> 222 | B223: Turrón | C223: 1479
A224: of:=[.$A223]+1 -> 223 | B224: Beef dishes | C224: 1474
A225: of:=[.$A224]+1 -> 224 | B225: Iced teas | C225: 1468
A226: of:=[.$A225]+1 -> 225 | B226: Fresh meals | C226: 1464
A227: of:=[.$A226]+1 -> 226 | B227: Cooking helpers | C227: 1463
A228: of:=[.$A227]+1 -> 227 | B228: Canned sardines | C228: 1461
A229: of:=[.$A228]+1 -> 228 | B229: Meals with chicken | C229: 1447
A230: of:=[.$A229]+1 -> 229 | B230: Sugars | C230: 1446
A231: of:=[.$A230]+1 -> 230 | B231: Semi-skimmed milks | C231: 1426
A232: of:=[.$A231]+1 -> 231 | B232: UHT Milks | C232: 1384
A233: of:=[.$A232]+1 -> 232 | B233: Nut butters | C233: 1375
A234: of:=[.$A233]+1 -> 233 | B234: Fermented drinks | C234: 1370
A235: of:=[.$A234]+1 -> 234 | B235: Sliced breads | C235: 1368
A236: of:=[.$A235]+1 -> 235 | B236: Almonds | C236: 1364
A237: of:=[.$A236]+1 -> 236 | B237: Refrigerated meals | C237: 1361
A238: of:=[.$A237]+1 -> 237 | B238: Common beans | C238: 1355
A239: of:=[.$A238]+1 -> 238 | B239: Emmentaler | C239: 1328
A240: of:=[.$A239]+1 -> 239 | B240: Mushrooms and their products | C240: 1328
A241: of:=[.$A240]+1 -> 240 | B241: Red wines | C241: 1320
A242: of:=[.$A241]+1 -> 241 | B242: Chocolate bars | C242: 1314
A243: of:=[.$A242]+1 -> 242 | B243: Fermented milk drinks | C243: 1310
A244: of:=[.$A243]+1 -> 243 | B244: Gelified candies | C244: 1292
A245: of:=[.$A244]+1 -> 244 | B245: Goat cheeses | C245: 1268
A246: of:=[.$A245]+1 -> 245 | B246: Food additives | C246: 1268
A247: of:=[.$A246]+1 -> 246 | B247: Dried hams | C247: 1261
A248: of:=[.$A247]+1 -> 247 | B248: Colas | C248: 1243
A249: of:=[.$A248]+1 -> 248 | B249: Plant-based meals | C249: 1239
A250: of:=[.$A249]+1 -> 249 | B250: Salad dressings | C250: 1222
A251: of:=[.$A250]+1 -> 250 | B251: Puffed cereal cakes | C251: 1222
A252: of:=[.$A251]+1 -> 251 | B252: Long grain rices | C252: 1220
A253: of:=[.$A252]+1 -> 252 | B253: Ice cream tubs | C253: 1219
A254: of:=[.$A253]+1 -> 253 | B254: Mixed cereal flakes | C254: 1217
A255: of:=[.$A254]+1 -> 254 | B255: Pasta sauces | C255: 1216
A256: of:=[.$A255]+1 -> 255 | B256: Strawberry jams | C256: 1187
A257: of:=[.$A256]+1 -> 256 | B257: Canned fruits | C257: 1179
A258: of:=[.$A257]+1 -> 257 | B258: Plain yogurts | C258: 1154
A259: of:=[.$A258]+1 -> 258 | B259: Chocolate spreads | C259: 1143
A260: of:=[.$A259]+1 -> 259 | B260: Pork meals | C260: 1140
A261: of:=[.$A260]+1 -> 260 | B261: Green olives | C261: 1131
A262: of:=[.$A261]+1 -> 261 | B262: Cereal bars | C262: 1121
A263: of:=[.$A262]+1 -> 262 | B263: Green teas | C263: 1114
A264: of:=[.$A263]+1 -> 263 | B264: Mushrooms | C264: 1112
A265: of:=[.$A264]+1 -> 264 | B265: Cocoa and chocolate powders | C265: 1109
A266: of:=[.$A265]+1 -> 265 | B266: Chocolate desserts | C266: 1099
A267: of:=[.$A266]+1 -> 266 | B267: Sardines in oil | C267: 1089
A268: of:=[.$A267]+1 -> 267 | B268: Rice dishes | C268: 1082
A269: of:=[.$A268]+1 -> 268 | B269: Grated cheese | C269: 1062
A270: of:=[.$A269]+1 -> 269 | B270: Spaghetti | C270: 1062
A271: of:=[.$A270]+1 -> 270 | B271: Shelled nuts | C271: 1058
A272: of:=[.$A271]+1 -> 271 | B272: Legume butters | C272: 1048
A273: of:=[.$A272]+1 -> 272 | B273: Peanut butters | C273: 1047
A274: of:=[.$A273]+1 -> 273 | B274: Crêpes and galettes | C274: 1031
A275: of:=[.$A274]+1 -> 274 | B275: Gingerbreads | C275: 1028
A276: of:=[.$A275]+1 -> 275 | B276: Cream soups | C276: 1025
A277: of:=[.$A276]+1 -> 276 | B277: Whole foies gras | C277: 1016
A278: of:=[.$A277]+1 -> 277 | B278: Multifruit juices | C278: 1012
A279: of:=[.$A278]+1 -> 278 | B279: Cooked chicken | C279: 1010